{
  "activity_id": 3,
  "activity_name": "Close",
  "category_name": "Findings",
  "category_uid": 2,
  "class_name": "Detection Finding",
  "class_uid": 2004,
  "count": 4,
  "end_time": 1767225600000,
  "finding_info": {
    "analytic": {
      "name": "alert pipeline",
      "type": "Rule",
      "type_id": 1
    },
    "related_analytics": [
      {
        "name": "rule-1",
        "type": "Rule",
        "type_id": 1
      },
      {
        "name": "rule-2",
        "type": "Rule",
        "type_id": 1
      }
    ],
    "title": "rule-1 and 1 other rule",
    "uid": "f8bcd62a829b1126"
  },
  "message": "rule-1 and 1 other rule",
  "metadata": {
    "product": {
      "name": "rsigma",
      "vendor_name": "rsigma",
      "version": "0.20.0"
    },
    "uid": "00000000-0000-4000-8000-000000000001",
    "version": "1.1.0"
  },
  "resources": [
    {
      "name": "alice",
      "type": "match.User"
    }
  ],
  "severity": "High",
  "severity_id": 4,
  "start_time": 1767225000000,
  "status": "Resolved",
  "status_id": 4,
  "time": 1767225600000,
  "timezone_offset": 0,
  "type_name": "Detection Finding: Close",
  "type_uid": 200403,
  "unmapped": {
    "refs": [
      {
        "level": "high",
        "rule": "rule-1"
      }
    ],
    "rule_counts": {
      "rule-1": 3,
      "rule-2": 1
    },
    "state": "resolved",
    "trigger": "resolved"
  }
}
